http://www.20minutes.fr/insolite/1428047-20140813-tue-colocataire-demande-siri-o-cacher-corps,Il tue son colocataire et demande à Siri où cacher le corps
https://www.slate.fr/story/148653/taiwan-divorce-mari-ignore-messages-application-line,"À Taïwan, une femme obtient le divorce parce que son mari a ignoré ses messages"
http://www.lalibre.be/actu/sciences-sante/inquietant-jusqu-a-70-litres-d-urine-dans-les-piscines-publiques-58bd07c0cd708ea6c104c7c5,Inquiétant: Jusqu’à 70 litres d’urine dans les piscines publiques
http://tempsreel.nouvelobs.com/en-direct/a-chaud/39788-partisocialiste-faute-argent-siege-solferino-serie.html,"Faute d'argent, le PS loue son siège de Solférino... à la série ""Baron noir"""
http://www.ufunk.net/insolite/eclore-oeufs-supermarche/,Il fait éclore des oeufs bio du supermarché et se retrouve avec deux poussins !
http://www.rtl.be/info/monde/europe/un-homme-perd-un-testicule-en-essayant-d-entrer-dans-le-zoo-d-amsterdam-907442.aspx,Un homme perd un testicule en essayant d'entrer dans le zoo d'Amsterdam
http://tempsreel.nouvelobs.com/les-internets/20170718.OBS2216/en-pleine-nuit-un-collegien-prend-possession-du-compte-twitter-du-ministere-de-la-culture.html,"En pleine nuit, un collégien prend possession du compte Twitter du ministère de la Culture"
http://www.usinenouvelle.com/article/cense-proteger-les-humains-un-robot-de-securite-disjoncte-et-se-jette-dans-une-fontaine.N567004,"Censé protéger les humains, un robot de sécurité disjoncte et se jette dans une fontaine - Robotique"
http://www.20minutes.fr/politique/2106599-20170719-emmanuel-macron-photo-officielle-oblige-36000-maires-france-racheter-cadre,Emmanuel Macron: Sa photo officielle oblige les 36.000 maires de France à racheter un cadre
http://www.valeursactuelles.com/economie/bhl-qui-trop-de-maisons-vend-une-villa-6-millions-deuros-85865,"BHL, qui a “trop de maisons”, vend une villa à 6 millions d’euros"
https://limportant.fr/infos-afrique/50/382147,"Rwanda : 3 semaines avant les élections, Paul Kagame annonce sa victoire"
http://sport24.lefigaro.fr/le-scan-sport/2017/07/15/27001-20170715ARTFIG00044-l-athlete-americain-gil-roberts-controle-positif8230-a-cause-de-baisers-avec-sa-femme.php?xtor=AL-155-[twitter]#link_time=1500113986,L'athlète américain Gil Roberts contrôlé positif... à cause de baisers avec sa femme
http://www.journaldugeek.com/2017/07/18/la-chine-censure-winnie-lourson-parce-quil-ressemble-trop-au-president/,La Chine censure Winnie l’Ourson parce qu’il ressemble trop au président
http://www.lapresse.ca/actualites/insolite/201701/20/01-5061475-la-journee-nationale-du-pop-corn-mene-a-larrestation-dun-trafiquant-de-drogue.php,La journée nationale du pop-corn mène à l'arrestation d'un trafiquant de drogue
http://www.journaldugeek.com/2017/01/16/en-2016-123456-etait-encore-le-mot-de-passe-le-plus-utilise-par-les-internautes/,"En 2016, « 123456 » était encore le mot de passe le plus utilisé par les internautes"
http://www.leparisien.fr/insolite/bourges-une-cantine-pour-ouvriers-honoree-par-erreur-d-une-etoile-au-michelin-16-02-2017-6685614.php,Bourges : une cantine pour ouvriers honorée par erreur d'une étoile au Michelin
http://www.ulyces.co/news/la-police-arrete-un-pigeon-avec-200-comprimes-decstasy-dans-son-sac-a-dos/,La police arrête un pigeon avec 200 comprimés d’ecstasy dans son sac à dos
http://www.lemonde.fr/big-browser/article/2017/07/18/en-russie-le-hand-spinner-vu-comme-une-menace-pour-le-kremlin_5162134_4832693.html#link_time=1500405406,"En Russie, le « hand spinner » vu comme une menace pour le Kremlin"
"http://www.marieclaire.fr/31-moins-de-31-katch-reyners-zoe-reyners-deputes-assemblee-nationale-tinder,1186211.asp",Une sorte de Tinder de la politique présente les 31 députés célibataires
http://www.leparisien.fr/politique/une-deputee-lrem-cherche-un-assistant-parlementaire-pour-travailler-aux-cotes-de-son-conjoint-18-07-2017-7141887.php#xtor=AD-1481423553,Une députée LREM cherche un assistant parlementaire pour travailler «aux côtés de son conjoint»
http://journalmetro.com/actualites/national/1169497/daniel-cohn-bendit-propose-au-quebec-de-rejoindre-lunion-europeenne/,Daniel Cohn-Bendit propose au Québec de rejoindre l’Union européenne
http://www.francetvinfo.fr/societe/education/un-journaliste-d-envoye-special-raconte-comment-il-a-reussi-a-devenir-prof-de-maths-apres-un-entretien-de-10-minutes_1903139.html,"Un journaliste d'""Envoyé spécial"" raconte comment il a réussi à devenir prof de maths après un entretien de 10 minutes"
http://www.20minutes.fr/strasbourg/2027619-20170309-alsace-avant-tenter-tuer-mere-appelle-radio-conseil-heritage,"Alsace: Avant de tenter de tuer sa mère, il appelle la radio pour un conseil sur l’héritage"
http://france3-regions.francetvinfo.fr/occitanie/aude/bac-option-chasse-limoux-aude-1182921.html,Un Bac option chasse à Limoux dans l'Aude
http://www.sudouest.fr/2017/07/15/video-une-maison-aspiree-par-une-fosse-septique-en-floride-3621193-4803.php,Vidéo. Une maison aspirée par une fosse septique en Floride
http://www.bfmtv.com/international/donald-trump-se-fait-apporter-un-coca-dans-le-bureau-ovale-en-appuyant-sur-un-bouton-1151996.html,Donald Trump se fait apporter un Coca dans le Bureau ovale en appuyant sur un bouton
http://www.lalibre.be/light/insolite/arrete-par-la-police-un-homme-tente-de-s-en-sortir-avec-une-carte-sortie-de-prison-du-monopoly-59574011cd706e263e8df0e4,"Arrêté par la police, un homme tente de s'en sortir avec une carte ""sortie de prison"" du Monopoly"
https://actu.fr/occitanie/toulouse_31555/a-toulouse-bar-organise-une-soiree-speed-dating-gens-moches_8611983.html,"À Toulouse, un bar organise une soirée speed-dating pour les gens... moches !"
http://speech.konbini.com/news/usa-logo-ps-tee-shirt-hipster/,"Aux States, le logo du PS sert à faire des T-shirts pour hipsters"
https://www.slate.fr/story/144508/employe-obtient-droit-traiter-son-patron-encule,Un employé américain obtient le droit de traiter son patron d'enculé sans être viré
https://actu.fr/insolite/vous-etes-stresse-bretagne-venez-exploser-frigos-coups-masse_10616933.html,"Vous êtes stressé ? En Bretagne, venez exploser des frigos à coups de masse"
http://www.20min.ch/ro/news/faits_divers/story/12574878,Il s'assied sur son arme et se tire dans le pénis
http://www.lci.fr/14-juillet/sur-twitter-melania-trump-remercie-emmanuel-macron-en-mentionnant-un-compte-anti-macron-2058576.html,"Sur Twitter, Mélania Trump remercie Emmanuel Macron en mentionnant un compte ""anti-Macron"""
http://www.leparisien.fr/faits-divers/etats-unis-indemnes-apres-avoir-ete-aspires-par-une-tornade-dans-leur-baignoire-30-01-2017-6639843.php#xtor=AD-1481423552,Etats-Unis : indemnes après avoir été aspirés par une tornade dans leur baignoire
http://www.sudouest.fr/2016/12/26/hypnotise-devant-sa-tele-denis-a-ete-chamboule-3056245-2780.php,"Un Landais hypnotisé devant sa télé : ""ça ne s’est pas bien passé ensuite"""
http://www.konbini.com/fr/tendances-2/repasser-ses-chemises-le-conseil-minceur-hallucinant-de-cosmopolitain/,"""Repasser ses chemises"", le conseil minceur hallucinant de Cosmopolitan"
http://www.letudiant.fr/trendy/bien-etre/sport-etudiant/le-plumfoot-c-est-fait-pour-vous-trendy-sport-l-a-teste.html,Le plumfoot est-il fait pour vous ? Le test de Trendy Sport
https://8e-etage.fr/2017/03/23/colombie-il-nest-plus-interdit-de-consommer-de-la-drogue-avant-de-se-rendre-au-travail/,Colombie : Il n'est plus interdit de consommer de la drogue avant de se rendre au travail
http://etudiant.lefigaro.fr/article/elle-accuse-son-prof-de-crime-de-guerre-et-recoit-une-glace_465737fe-41f7-11e7-a469-62c36d07d43b/,Elle accuse son prof de crime de guerre... et reçoit une glace
https://www.slate.fr/story/147942/ne-pas-manger-son-placenta,"Après un cas d'infection, les autorités américaines déclarent qu'il ne faut pas manger son placenta"
http://www.konbini.com/fr/tendances-2/samsung-construit-ecran-iphone-8/?variante=2,WTF : c'est Samsung qui construit l'écran de l'iPhone 8
http://bfmbusiness.bfmtv.com/entreprise/cette-start-up-veut-creer-une-maison-de-retraite-pour-vieilles-poules-1109008.html,Cette start-up veut créer une maison de retraite pour vieilles poules
http://www.ouest-france.fr/bac/hors-sujet-quelle-que-soit-ma-note-au-bac-je-la-tweeterai-2/20-5114153,"Hors sujet. « Quelle que soit ma note au bac, je la tweeterai » : 2/20"
https://www.vice.com/fr/article/d7pxmk/sapiosexuels-sexe-intelligence,"À la rencontre des sapiosexuels, ceux qui ne baisent qu'avec des gens intelligents"
http://www.purepeople.com/article/nadine-morano-j-ai-ete-majorette-sur-le-tour-de-france_a242317/1,"Nadine Morano : ""J'ai été majorette sur le Tour de France !"""
http://www.lalibre.be/light/insolite/une-video-de-nirvana-jouant-dans-un-magasin-d-electromenager-apparait-29-ans-plus-tard-video-595e9addcd706e263ea72d56,Une vidéo de Nirvana jouant dans un magasin d'électroménager apparaît 29 ans plus tard
http://lelab.europe1.fr/ou-lon-apprend-que-le-chef-cuistot-de-lelysee-prepare-des-mini-cordons-bleus-pour-les-cocktails-presidentiels-3388226,Où l’on apprend que le chef cuistot de l’Elysée prépare des mini cordons bleus pour les cocktails présidentiels.
http://www.journaldugeek.com/2017/07/11/une-start-up-lance-un-service-de-parapluies-en-libre-service-et-les-perd-quasiment-tous-en-3-mois/,Une start-up lance un service de parapluies en libre-service... Et les perd quasiment tous en 3 mois
http://sport24.lefigaro.fr/le-scan-sport/2017/02/23/27001-20170223ARTFIG00181-apres-86-matches-sans-victoire-andorre-a-enfin-gagne.php,"Après 86 matches sans victoire, Andorre a enfin gagné"
https://www.slate.fr/story/125840/parisiens-sympas-allemande,"Scandale, les Parisiens sont devenus sympas"
http://www.estrepublicain.fr/insolite/2017/07/15/qu-est-ce-qui-est-bleu-et-qui-attend-une-blague-moins-drole,"""Qu'est-ce qui est bleu et qui attend ?"""
http://www.lalibre.be/light/insolite/un-singe-devenu-obese-en-engloutissant-la-nourriture-jetee-par-les-touristes-59073ce6cd70812a65c1b897,Un singe devenu obèse en engloutissant la nourriture jetée par les touristes
http://www.estrepublicain.fr/insolite/2017/07/14/wifi-en-cochant-trop-vite-les-conditions-ils-acceptent-de-nettoyer-des-wc,"En cochant trop vite les conditions d'utilisation, ils acceptent de nettoyer des WC"
http://www.fredzone.org/au-japon-un-homme-sest-marie-avec-un-personnage-virtuel-038,"Au Japon, un homme s'est marié avec un personnage virtuel"
http://www.ouest-france.fr/societe/fetes/14-juillet/14-juillet-line-renaud-et-donald-trump-la-rencontre-surrealiste-du-jour-5134864,"14-Juillet. Line Renaud et Donald Trump, la rencontre surréaliste du jour"
http://lelab.europe1.fr/edouard-philippe-confie-avoir-lecrivaine-marguerite-yourcenar-qui-laccompagne-dans-les-arbitrages-budgetaires-3387977,"Edouard Philippe confie avoir l'écrivaine ""Marguerite Yourcenar qui l'accompagne dans les arbitrages budgétaires""."
http://www.rfi.fr/asie-pacifique/20170713-pakistan-clan-sharif-menace-police-caracteres-calibri?ref=tw_i,Pakistan: le clan Sharif menacé par la police de caractères Calibri
http://www.leparisien.fr/faits-divers/inde-ils-livrent-leurs-proches-aux-tigres-pour-toucher-une-indemnite-07-07-2017-7119147.php,Inde : ils livrent leurs proches aux tigres pour toucher une indemnité
http://www.ouest-france.fr/monde/chine/chine-la-reconnaissance-faciale-pour-en-finir-avec-le-vol-de-pq-4873461,Chine. La reconnaissance faciale pour en finir avec le vol de PQ
http://www.20min.ch/ro/news/vaud/story/La-Municipalite-decide-de-ne-pas-decider-avant-lundi-13445942,La Municipalité décide de ne pas décider avant lundi
https://www.slate.fr/story/138002/scandale-candidat-devoile-sexe,"Par anticipation, un candidat au poste de gouverneur dévoile toute sa vie sexuelle"
https://www.slate.fr/story/145692/minitel-election-marine-le-pen,Le Minitel a-t-il empêché l’élection de Marine Le Pen?
https://www.slate.fr/story/141506/gif-arme-du-crime,L'arme du crime était un GIF
https://www.slate.fr/story/143675/tuto-youtube-enfant-8-ans-apprend-conduire-mcdonalds,"Grâce à un tuto YouTube, un enfant de 8 ans apprend à conduire et va chez McDonald’s"
http://www.madmoizelle.com/supernatural-scooby-doo-775997,"En totale roue libre, Supernatural annonce un crossover avec Scooby-Doo"
https://www.slate.fr/story/148296/grand-tante-organise-fete-puis-part-tuer-180-juifs,"Pendant la fête organisée par sa grand-tante, les invités sont allés tuer 180 Juifs"
https://francais.rt.com/france/41059-cher-bibi-adresse-demmanuel-macron-bibi-netanyahou-twitter,«Cher Bibi» : l'adresse d'Emmanuel Macron à Benjamin Netanyahou déconcerte.
https://www.slate.fr/story/148554/trump-mur-mexique-sac-drogue,Trump craint que de «gros sacs de drogue» ne tombent sur la tête des Américains
http://www.lalibre.be/light/insolite/usa-coince-dans-une-banque-il-glisse-des-messages-dans-un-distributeur-de-billets-5968e73acd706e263ecdbc3d,"USA: coincé dans une banque, il glisse des messages dans un distributeur de billets"
http://www.dna.fr/actualite/2017/07/13/pour-polluer-moins-il-faudrait-faire-moins-d-enfants,"Pour polluer moins, il faudrait... faire moins d'enfants"
http://www.lalibre.be/actu/belgique/un-formateur-de-la-prison-de-mons-donnait-des-cours-d-ete-de-darknet-a-de-presumes-terroristes-59665192cd70d65d24b8978b,"Un formateur de la prison de Mons donnait des ""cours d'été"" de darknet à de présumés terroristes"
https://www.slate.fr/story/148029/kangourous-australie-voitures-autonomes-volvo,"En Australie, les voitures autonomes de Volvo n’arrivent pas à reconnaître les kangourous"
http://www.francetvinfo.fr/france/hauts-de-france/pas-de-calais/calais/xavier-bertrand-souhaite-autoriser-les-britanniques-a-rouler-a-gauche-a-calais-pour-un-week-end_2278143.html,Xavier Bertrand souhaite autoriser les Britanniques à rouler à gauche à Calais pour un week-end
http://www.bfmtv.com/police-justice/lyon-des-policiers-municpaux-croient-arracher-un-plan-de-cannabis-ils-detruisent-une-oeuvre-artistique-1211655.html,"Lyon: des policiers municipaux croient arracher un plan de cannabis, ils détruisent une oeuvre artistique"
http://www.lepoint.fr/societe/le-vatican-ne-veut-pas-d-hosties-sans-gluten-et-dit-oui-aux-ogm-08-07-2017-2141670_23.php?link_time=1499527150#xtor=CS1-32-[Echobox],Le Vatican ne veut pas d'hosties sans gluten et dit oui aux OGM
http://www.lefigaro.fr/musique/2017/07/10/03006-20170710ARTFIG00077-rohff-son-concert-annule-car-il-n-y-avait-que-13-personnes.php?xtor=AL-155-%5Bfacebook%5D#link_time=1499686653,Un concert de Rohff annulé en Algérie: il n'y avait que 13 personnes
http://www.lesinrocks.com/2017/07/news/une-deputee-macroniste-mord-un-chauffeur-de-taxi/,Une députée macroniste mord un chauffeur de taxi
https://www.yahoo.com/news/colombian-airline-wants-passengers-stand-095900457.html,Colombian airline wants to make passengers stand
http://speech.konbini.com/news/general-armee-part-week-end-avion-de-chasse/,"Sobre, un général de l’armée de l’air partait en week-end avec un Alphajet"
http://speech.konbini.com/news/lagarde-croit-gagner-moins-salaire-moyen-francais/,"Avec ses 11 552 euros par mois, ce député croit gagner ""moins que la moyenne des Français"""
https://siecledigital.fr/2017/06/28/navire-guerre-queen-elizabeth-windows-xp/,Cybersécurité : le dernier navire de guerre anglais utilise Windows XP.
http://www.ulyces.co/news/ce-canon-laser-anti-moustiques-est-dune-precision-redoutable/,Ce canon laser anti-moustiques est d’une précision redoutable
http://www.leparisien.fr/faits-divers/saut-a-l-elastique-il-dit-no-jump-elle-comprend-now-jump-saute-et-se-tue-28-06-2017-7096419.php,"Saut à l'élastique : il dit «no jump», elle comprend «now jump», saute et se tue"
http://www.ozap.com/actu/-on-n-est-pas-couche-christine-angot-remplace-vanessa-burggraf/532202,"""On n'est pas couché"" : Christine Angot remplace Vanessa Burggraf"
http://www.huffingtonpost.fr/2017/07/10/tpmp-rachid-arhab-hanouna_a_23023229/?ncid=tweetlnkfrhpmg00000001,"TPMP recrute un ancien membre du CSA, parmi ses nouveaux chroniqueurs"
http://www.rtl.fr/actu/conso/la-sncf-propose-des-trottinettes-connectees-en-libre-service-7789244260,La SNCF propose des trottinettes connectées en libre-service
http://www.estrepublicain.fr/faits-divers/2017/07/11/une-ado-de-14-ans-meurt-en-chargeant-son-telephone-dans-son-bain,Une ado de 14 ans meurt en chargeant son téléphone dans son bain
http://golem13.fr/beer-perth-airport/,"À l’aéroport, il enregistre sa canette de bière comme unique bagage"
https://www.lebonbon.fr/nuit/nuit-news/des-psychologues-veulent-interdire-peppa-pig-parce-que-ca-rend-les-enfants-cons/,Des psychologues veulent interdire Peppa Pig parce que ça rend les enfants cons
http://www.ouest-france.fr/pays-de-la-loire/nantes-44000/le-pizzaiolo-reconverti-attache-parlementaire-5113943#link_time=1499259208,Nantes. Le pizzaïolo soutien de Macron devient attaché parlementaire
https://fr.globalvoices.org/2017/06/30/212365/,Une centrale nucléaire tchèque organise un concours de maillot de bain pour choisir sa prochaine stagiaire
https://lelab.europe1.fr/et-le-kebab-nocturne-de-benoit-hamon-depassa-le-portrait-officiel-demmanuel-macron-en-nombre-de-retweets-3375884,Et le kebab nocturne de Benoît Hamon dépassa le portrait officiel d'Emmanuel Macron en nombre de retweets
http://www.konbini.com/fr/tendances-2/inde-recrudescence-dassassinats-de-mangeurs-de-viande-de-boeuf-inquiete/#link_time=1498841973,L’Inde subit une inquiétante vague d’assassinats de mangeurs de viande de bœuf
http://www.slate.fr/story/147330/operer-retirer-testicule-droit-chirurgiens-erreur,"Un homme entre au bloc pour se faire retirer le testicule droit, il en ressort sans son testicule gauche"
http://www.voici.fr/news-people/actu-people/pour-prouver-qu-un-livre-peut-stopper-une-balle-un-youtubeur-se-fait-tirer-dessus-par-sa-copine-il-est-mort-636801,"Pour prou­ver qu’un livre peut stop­per une balle, un Youtu­beur se fait tirer dessus par sa copine : il est mort."
http://www.huffingtonpost.fr/2017/06/29/valerie-pecresse-va-demander-un-etat-des-lieux-du-manspreading_a_23007621/?ncid=tweetlnkfrhpmg00000001,"Valérie Pécresse va demander un ""état des lieux"" du manspreading dans les transports franciliens"
http://www.lci.fr/football/mondial-2022-au-qatar-deux-millions-de-dollars-atterrissent-sur-le-livret-epargne-de-la-fillette-d-un-membre-de-la-fifa-2-2056772.html#link_time=1498549329,"Mondial 2022 au Qatar : deux millions de dollars ""atterrissent"" sur le livret épargne de la fillette d'un membre de la Fifa"
https://motherboard.vice.com/fr/article/qk34eb/une-entreprise-a-lintention-de-faire-repousser-le-prpuce-des-hommes-circoncis,Une entreprise a l'intention de faire repousser le prépuce des hommes circoncis
"http://www.lindependant.fr/2017/06/23/barcelone-elle-loue-son-propre-appartement-sur-airbnb-pour-changer-les-serrures-et-chasser-son-locataire-indelicat,3027482.php",Barcelone: elle loue son propre appartement sur AirBnB pour changer les serrures et chasser son locataire indélicat
http://www.leparisien.fr/laparisienne/actualites/societe/quand-justin-trudeau-porte-des-chaussettes-aid-moubarak-a-la-marche-des-fiertes-26-06-2017-7088733.php#xtor=AD-1481423553,Justin Trudeau porte des chaussettes «Aid Moubarak» à la marche des fiertés
http://www.slate.fr/story/147651/homme-enterre-son-fils-reapparait-en-vie,"Un homme enterre son fils... qui réapparaît, bien en vie, quelques jours plus tard"
http://www.20minutes.fr/strasbourg/2091459-20170621-alsace-icone-fitness-decede-apres-explosion-siphon-chantilly,Alsace: Une icône du fitness décède après l'explosion de son siphon à chantilly...
http://www.jdubuzz.com/2017/06/23/ce-nest-pas-une-blague-le-premier-magazine-francais-dedie-au-hand-spinner-debarque/,"Ce n’est pas une blague, le premier magazine français dédié au Hand Spinner débarque"
http://www.sudouest.fr/2017/06/22/insolite-un-groupe-de-rock-basque-joue-a-nantes-devant-un-seul-spectateur-3555110-4018.php,Un groupe de rock basque joue à Nantes...devant un seul spectateur
http://www.gentside.com/insolite/belgique-cet-embouteillage-etait-coince-dans-une-foret-depuis-70-ans_art72969.html,Belgique : cet embouteillage était coincé dans une forêt depuis 70 ans
https://fr.metrotime.be/2017/06/09/actualite/gentil-integrer-police-chiot-a-recu-fonction/,"Trop gentil pour intégrer la police, ce chiot a reçu une autre fonction"
http://www.lefigaro.fr/placement/2017/06/23/05006-20170623ARTFIG00218-l-effet-macron-booste-l-immobilier-de-luxe-parisien.php#link_time=1498226576,L'effet Macron booste l'immobilier de luxe parisien
http://www.cnewsmatin.fr/france/2017-06-22/lagresseur-de-nkm-elle-me-regarde-pouf-elle-tombe-758416,"L'agresseur de NKM : «elle me regarde, pouf, elle tombe»"
https://www.streetpress.com/sujet/1498489306-poste-facture-lien-social,"La Poste facture 19,90 euros les 5 minutes de conversation avec votre grand-mère"
http://www.francetvinfo.fr/france/hauts-de-france/migrants-a-calais/j-ai-fait-ca-par-amour-une-ex-candidate-du-fn-jugee-pour-avoir-aide-un-migrant-a-rejoindre-le-royaume-uni_2255229.html#xtor=CS1-746,"""J'ai fait ça par amour"" : une ex-candidate du FN jugée pour avoir aidé un migrant à rejoindre le Royaume-Uni"
http://www.francetvinfo.fr/sports/jo/jo-2024/video-emmanuel-macron-joue-au-tennis-en-fauteuil-roulant-pour-soutenir-la-candidature-de-paris-aux-jo-2024_2252827.html,Emmanuel Macron joue au tennis en fauteuil roulant pour soutenir la candidature de Paris aux JO 2024
https://www.lequipe.fr/Taekwondo/Actualites/La-federation-internationale-de-taekwondo-ne-s-appelle-plus-wtf/813449,La Fédération internationale de taekwondo ne s'appelle plus «WTF»
http://www.slate.fr/story/147624/etang-gps-voiture,Il suit les indications de son GPS et finit dans un étang
http://footballstories.konbini.com/news/video-pogba-dab-match-caritatif/?variante=2#link_time=1498468909,Paul Pogba a marqué un but en dabbant
http://www.bfmtv.com/mediaplayer/video/enceinte-cet-homme-va-vivre-son-premier-accouchement-en-juillet-953423.html,"Enceinte, cet homme va vivre son premier accouchement en juillet"
http://www.estrepublicain.fr/faits-divers/2017/06/25/les-dominatrices-l-attachent-au-lit-et-derobent-sa-voiture,Les dominatrices l'attachent au lit et dérobent sa voiture
http://www.novaplanet.com/novamag/77063/napflix-les-contenus-les-plus-chiants-du-web-pour-bien-dormir,"Napflix, les contenus les plus chiants du web, pour bien dormir"
http://www.ouest-france.fr/culture/people/michel-sardou-le-chanteur-confie-avoir-un-faible-pour-brigitte-macron-5043040#link_time=1496758494,Michel Sardou. Le chanteur confie avoir un faible pour Brigitte Macron
http://www.huffingtonpost.fr/2017/06/23/il-va-a-disneyland-2000-jours-daffilee_a_22583772/,Il va à Disneyland 2000 jours d'affilée
http://cheese.konbini.com/orange/russie-distributeur-automatique-vend-likes-abonnes-instagram/,"En Russie, un distributeur automatique vend des likes et des abonnés Instagram"
http://blog.francetvinfo.fr/bureau-londres/2017/05/26/veterinaire-dublinois-recherche-calineur-de-chats-professionnel.html#xtor=CS1-746,Vétérinaire dublinois recherche câlineur de chats professionnel
http://www.liberation.fr/direct/element/en-thailande-le-carton-des-gateaux-en-forme-de-crotte-de-chien_66552/,"En Thaïlande, le carton des gâteaux en forme de crotte de chien"
http://www.lexpress.fr/actualite/monde/amerique-nord/7-des-americains-pensent-que-le-lait-chocolate-provient-des-vaches-marrons_1918270.html,7% des Américains pensent que le lait chocolaté provient des vaches marron
http://www.bfmtv.com/international/un-village-indien-change-son-nom-en-trump-1193342.html#page/contribution/index,Un village indien change son nom en « Trump »
http://www.liberation.fr/france/2017/06/22/le-fn-anxiogene-sur-l-immigration-selon-une-elue-fn_1578740?xtor=rss-450#link_time=1498126434,"Le FN «anxiogène» sur l'immigration, selon... une élue FN"
https://www.marianne.net/politique/affaire-ferrand-un-retour-de-la-morale-c-est-le-debut-de-la-charia-juge-ce-depute-lrem,"Affaire Ferrand : ""Un retour de la morale, c'est le début de la charia"", juge ce député LREM"
http://www.estrepublicain.fr/faits-divers/2017/06/21/il-se-tue-en-donnant-un-coup-de-pied-dans-une-vitre,Il se tue en donnant un coup de pied dans une vitre
https://www.slate.fr/story/147405/mattel-lance-ken-hipster,Mattel lance un Ken hipster qui porte un chignon
https://www.slate.fr/story/147351/etats-unis-tique-allergique-viande,"Aux États-Unis, la tique qui rend allergique à la viande se répand"
http://www.francetvinfo.fr/faits-divers/gironde-il-laisse-un-space-cake-dans-la-salle-de-repos-trois-salaries-d-un-magasin-font-un-malaise_2246899.html#xtor=RSS-3-[faitsdivers,"Gironde : il laisse un ""space cake"" dans la salle de repos, trois salariés font un malaise"
http://www.lefigaro.fr/elections/legislatives/2017/06/21/38001-20170621LIVWWW00021-en-direct-remaniement-gouvernement-emmanuel-macron-edouard-philippe-francois-bayrou.php,DÉJÀ PRIS - Un orchestre colombien empêche l'annonce du nouveau gouvernement sur le perron de l'Élysée
http://www.20minutes.fr/lille/2088587-20170618-calais-mari-vit-jour-nuit-combinaison-plongee-craque,"Calais : Son mari vit jour et nuit en combinaison de plongée, elle craque"
