https://www.liberation.fr/direct/element/pour-schiappa-wauquiez-est-la-preuve-quapprendre-larabe-nest-pas-dangereux_120041/,"Pour Schiappa, Wauquiez est la preuve qu’apprendre l’arabe n’est pas dangereux"
https://www.francetvinfo.fr/politique/eric-zemmour/marine-le-pen-juge-les-propos-d-eric-zemmour-excessifs-mais-se-demande-s-ils-valent-poursuites-judiciaires_4130443.html?Echobox=1601973850#xtor=CS1-746,"Marine Le Pen juge les propos d'Eric Zemmour ""excessifs"""
https://www.journaldunet.com/media/publishers/1494039-linkedin-va-t-il-se-faire-instagramiser/,LinkedIn va-t-il se faire Instagramiser ?
https://www.leprogres.fr/insolite/2020/09/28/sa-mort-n-a-pas-ete-un-obstacle-un-maire-roumain-triomphalement-reelu,Insolite. Un maire roumain réélu alors qu'il était mort depuis 11 jours du Covid-19
https://www.leparisien.fr/economie/consommation/le-cuisinier-d-un-restaurant-peut-il-refuser-de-cuire-une-viande-rouge-a-point-24-09-2020-8390520.php#xtor=AD-1481423552,Le cuisinier d’un restaurant peut-il refuser de cuire une viande rouge à point ?
https://rmcsport.bfmtv.com/tennis/roland-garros-nelson-monfort-provoque-l-interruption-d-un-match-en-parlant-trop-fort-1983435.html,Roland-Garros: Nelson Monfort provoque l'interruption d'un match... en parlant trop fort
https://www.courrierinternational.com/article/insolite-la-deutsche-bank-accorde-un-pret-bancaire-garanti-en-parmesan,La Deutsche Bank accorde un prêt bancaire garanti en parmesan
https://www.courrierinternational.com/article/partenariat-contre-le-covid-19-en-indonesie-des-gangsters-appeles-en-renfort-par-la-police,"Contre le Covid-19, en Indonésie, des gangsters appelés en renfort par la police"
https://www.marianne.net/politique/covid-19-sibeth-ndiaye-met-le-fiasco-de-la-communication-gouvernementale-sur-le-dos-des?Echobox=1600952444,Covid-19 : Sibeth Ndiaye met le fiasco de la communication gouvernementale sur le dos des Français
https://www.lepopulaire.fr/limoges-87000/loisirs/francois-hollande-et-jean-plantu-rendent-hommage-a-gerard-vandenbroucke-au-salon-du-dessin-de-presse-et-d-humour_13847372/#refresh,François Hollande et Jean Plantu rendent hommage à Gérard Vandenbroucke au salon du dessin de presse et d'humour
https://la1ere.francetvinfo.fr/mayotte/dhoihir-dhoulkamal-le-ministre-comorien-des-affaires-etrangeres-s-est-fait-passer-pour-un-mahorais-pour-frauder-la-securite-sociale-a-la-reunion-877606.html,"Ministre aux Comores, allocataire de la CMU à La Réunion"
https://www.ladepeche.fr/2020/10/09/toulouse-un-escape-game-propose-de-tuer-emmanuel-macron-9128775.php,"Toulouse : une salle d'escape game propose de ""tuer"" Emmanuel Macron"
https://www.konbini.com/fr/cinema/le-film-sur-le-covid-19-produit-par-michael-bay-ne-respecte-pas-les-consignes-sanitaires,Le film sur le Covid-19 produit par Michael Bay ne respecte pas les consignes sanitaires
https://www.bfmtv.com/international/une-mouche-se-pose-sur-le-crane-de-pence-pendant-son-debat-avec-harris-et-provoque-l-hilarite_AD-202010080033.html,Une mouche se pose sur le crâne de Pence pendant son débat avec Harris... et lui vole la vedette
https://www.msn.com/fr-fr/actualite/monde/lait-entier-ou-lait-damande-il-finit-poignard%c3%a9-par-son-cousin-apr%c3%a8s-un-d%c3%a9bat-qui-tourne-mal/ar-BB19D7p9?ocid=sf2,Lait entier ou lait d’amande? Il finit poignardé par son cousin après un débat qui tourne mal
https://www.bfmtv.com/auto/a-angers-un-feu-reste-bloque-au-rouge-et-paralyse-la-circulation_AV-202010020133.html,"A Angers, un feu reste bloqué au rouge et paralyse la circulation"
https://www.liberation.fr/debats/2020/10/01/pauline-harmange-elle-les-hommes-elle-les-deteste_1800981?xtor=CS7-50-#Echobox=1601581520,"Pauline Harmange : elle, les hommes, elle les déteste - Libération"
https://www.cnews.fr/france/2020-09-28/paris-un-appartement-de-7-metres-carres-vendu-300000-euros-1002852,"A Paris, un appartement de 7 mètres carrés vendu 300.000 euros"
https://www.lepoint.fr/societe/de-la-cocaine-a-la-maternelle-six-enfants-hospitalises-08-10-2020-2395552_23.php,"De la cocaïne à la maternelle, six enfants hospitalisés"
https://etudiant.lefigaro.fr/article/apres-5-jours-de-greve-de-la-faim-un-etudiant-obtient-une-place-en-master_85629dc0-fd70-11ea-9ef3-0e4e93e7a417/#Echobox=1600863308,"Après 5 jours de grève de la faim, un étudiant obtient une place en master"
https://www.lindependant.fr/2020/09/28/zones-de-contamination-rouges-vers-le-super-rouge-ou-rouge-ecarlate-9102899.php,Zones de contamination rouges : vers le super rouge ou rouge écarlate
https://france3-regions.francetvinfo.fr/occitanie/insolite-militant-ecologiste-juge-appel-montpellier-violences-jet-feuilles-origine-vegetale-1881024.html,"Insolite : un militant écologiste jugé en appel à Montpellier pour violences avec ""jet de feuilles d'origine végétale"""
https://www.lejdd.fr/Culture/amelie-nothomb-le-dimanche-je-passe-le-balai-en-ecoutant-du-metal-3994660,"Amélie Nothomb : ""Le dimanche, je passe le balai en écoutant du metal"""
https://www.francebleu.fr/infos/societe/coronavirus-l-homme-de-neandertal-serait-responsable-des-formes-graves-du-virus-1601620162,Coronavirus : l'homme de Neandertal pourrait être responsable des formes graves du virus
https://www.turbo.fr/actualite-automobile/ils-recoltent-pres-dun-demi-million-pour-tuner-un-fiat-multipla-1000-ch-168254,Ils récoltent près d'un demi-million pour tuner un Fiat Multipla à 1000 ch !
https://www.huffingtonpost.fr/entry/le-pape-estime-que-le-plaisir-sexuel-est-simplement-divin_fr_5f5a04cbc5b6b48507fc7a53?hash=8c339672-059c-428b-82eb-6551c6ae58c4,"Le Pape estime que le plaisir sexuel est ""simplement divin"""
https://www.histoiresgalantes.fr/blog/2018/03/01/ermite-de-jardin-un-job-tres-tendance-en-anglettre-fin-xviiie-siecle/,"Ermite de jardin, un job très tendance en Angleterre fin XVIIIe siècle !"
https://www.vice.com/fr/article/7kpa3z/le-mystere-de-la-brochette-boeuf-fromage-japonaise-qui-nexiste-pas-au-japon,Le mystère de la brochette bœuf-fromage japonaise qui n'existe pas au Japon
https://www.cnews.fr/france/2020-09-16/apres-les-oreilles-le-montpellierain-black-alien-se-fait-retirer-le-nez-999125,"Après les oreilles, le Montpelliérain « Black Alien » se fait retirer le nez"
https://www.leparisien.fr/politique/le-depute-jean-lassalle-se-gare-sur-un-passage-a-niveau-et-bloque-un-train-20-09-2020-8388396.php#xtor=AD-14814235,Le député Jean Lassalle se gare sur un passage à niveau... et bloque un train
https://www.cnews.fr/monde/2020-09-17/il-trouve-un-cerveau-enveloppe-dans-du-papier-aluminium-sur-une-plage-999448,Il trouve un cerveau enveloppé dans du papier aluminium sur une plage
https://madame.lefigaro.fr/societe/elles-ont-monte-un-fight-club-dans-une-creche-040915-98013,Deux nounous organisaient des combats d'enfants dans une crèche
https://www.courrierinternational.com/article/ecoles-ils-ont-oublie-les-trous-pour-les-yeux-en-grece-le-fiasco-des-masques-trop-grands?Echobox=1600184541,"“Ils ont oublié les trous pour les yeux” : en Grèce, le fiasco des masques trop grands"
https://www.voaafrique.com/a/la-belgique-va-rendre-%C3%A0-sa-famille-une-dent-de-lumumba/5578302.html,La Belgique va remettre une dent de Patrice Lumumba à sa famille
https://www.huffingtonpost.fr/entry/jean-michel-blanquer-revele-avoir-joue-pour-lequipe-de-rugby-de-colombie_fr_5f79b22ac5b64b480aaf2369?ncid=tweetlnkfrhpmg00000001,Jean-Michel Blanquer a joué pour l'équipe de rugby de Colombie
https://www.lefigaro.fr/politique/chasse-a-courre-un-depute-lrem-propose-de-remplacer-les-animaux-par-des-robots-20201007,Chasse à courre : un député LREM propose de remplacer les animaux... par des robots
https://www.francetvinfo.fr/societe/harcelement-sexuel/paris-un-graffeur-parisien-soupconne-de-viols-et-agressions-sexuelles-presente-a-un-juge-d-instruction_4126407.html,"Paris : le graffeur connu pour ses tags ""L'amour court les rues"" mis en examen pour viols et agressions sexuelles"
https://www.gala.fr/l_actu/news_de_stars/jacques-chirac-sa-phrase-choc-je-nai-pas-trompe-ma-femme-je-me-suis-trompe-de-femme_455560,"Jacques Chirac, sa phrase choc : « Je n'ai pas trompé ma femme, je me suis trompé de femme »"
https://www.marianne.net/politique/n-oubliez-pas-qu-s-adresse-des-ce1-ou-des-ce2-en-reunion-le-president-du-loir-et-cher,"""N'oubliez pas qu'on s'adresse à des CE1 ou des CE2"" : en réunion, le président du Loir-et-Cher jauge le niveau de ses électeurs"
http://www.slate.fr/story/195164/prof-americain-suspendu-cause-mot-chinois-ressemblant-negre,Un prof américain suspendu à cause d'un mot chinois ressemblant à «nègre»
https://www.ledauphine.com/insolite/2020/09/05/insolite-avec-une-pasteque-il-joue-de-la-musique-electronique,"Insolite | Insolite : avec une pastèque, il joue de la musique électronique"
https://www.beinsports.com/france/football/news/can-le-trophee-a-ete-perdu-par-la-federation-/1538056,CAN : Le trophée a été perdu par la fédération égyptienne
https://www.cnews.fr/monde/2020-09-22/des-billets-davion-pour-nulle-part-sarrachent-en-quelques-minutes-1000868,Des billets d’avion pour nulle part s'arrachent en quelques minutes
https://www.ouest-france.fr/economie/transports/avion/la-passagere-avait-trop-chaud-elle-sort-se-rafraichir-sur-l-aile-de-l-avion-6960650#Echobox=1599235766,"La passagère avait trop « chaud », elle sort se rafraîchir sur l’aile de l’avion"
"https://www.larepubliquedespyrenees.fr/2020/09/05/bearn-un-tracheotomise-ote-son-masque-pour-se-faire-comprendre-il-est-verbalise,2733032.php","Béarn : un trachéotomisé ôte son masque pour se faire comprendre, il est verbalisé"
https://www.ladepeche.fr/2020/09/04/on-peut-oter-son-masque-pour-manger-son-pop-corn-au-cinema-rappelle-la-ministre-de-la-culture-roselyne-bachelot-9049630.php,"""On peut ôter son masque pour manger son pop-corn"" au cinéma, rappelle la ministre de la Culture, Roselyne Bachelot"
https://www.20min.ch/fr/story/voisin-de-lhopital-il-porte-plainte-pour-les-cris-des-femmes-qui-accouchent-835368111181,"Zurich: Voisin de l’hôpital, il porte plainte pour les cris des femmes qui accouchent"
https://www.ouest-france.fr/leditiondusoir/data/104448/reader/reader.html?h=%23%21preferred%2F1%2Fpackage%2F104448%2Fpub%2F157309%2Fpage%2F14#!preferred/1/package/104448/pub/157309/page/14,"Il retire son masque pour manger un pain au chocolat, il est arrêté et conduit au poste"
https://www.bfmtv.com/international/italie-ils-veulent-prouver-que-la-terre-est-plate-et-se-perdent-en-haute-mer_AN-202009030355.html,Italie: ils veulent prouver que la Terre est plate et se perdent en haute mer
https://www.7sur7.be/monde/en-revelant-le-sexe-de-leur-bebe-lors-d-une-fete-de-famille-ils-mettent-le-feu-a-2800-hectares-de-foret~a692d021/?referrer=https%3A%2F%2Fl.facebook.com%2F,"En révélant le sexe de leur bébé lors d’une fête de famille, ils mettent le feu à 2800 hectares de forêt | Monde"
https://www.cnews.fr/monde/2020-09-15/en-indonesie-des-anti-masques-condamnes-creuser-les-tombes-des-victimes-du-covid-19,"En Indonésie, des anti-masques condamnés à creuser les tombes des victimes du Covid-19"
http://www.lessentiel.lu/fr/news/insolites/story/il-porte-son-serpent-comme-masque-de-protection-17200167,Il porte son serpent comme masque de protection
https://www.football-addict.com/fr/article/general/ligue-1-geubbels-surgit-du-neant-et-monaco-prend-le-bon-wagon/5f5e5c3df5a44f00086e02db,Ligue 1 : Geubbels surgit du néant et Monaco prend le bon wagon
https://www.huffingtonpost.fr/entry/les-cas-contacts-de-cas-contacts-ne-sont-pas-des-cas-contacts-explications_fr_5f645939c5b6480e896c7b99,"""Les cas contacts de cas contacts ne sont pas des cas contacts"": explications"
https://www.lapresse.ca/international/etats-unis/2020-09-04/etats-unis-une-universitaire-qui-se-disait-noire-admet-etre-blanche.php,États-Unis: une universitaire qui se disait noire admet être blanche
https://www.liberation.fr/direct/element/inedit-un-depute-quitte-le-groupe-quil-preside_118719/,Inédit : un député quitte le groupe qu’il préside - Libération
https://www.cnews.fr/monde/2020-09-10/il-grignote-pendant-4-heures-pour-ne-pas-mettre-son-masque-dans-lavion-997033,Il grignote pendant 4 heures pour ne pas mettre son masque dans l'avion
https://www.rtl.be/info/monde/international/une-fillette-de-3-ans-emportee-par-le-vent-a-taiwan-lors-d-un-festival-de-cerfs-volants-video--1240825.aspx,Une fillette de 3 ans EMPORTÉE par le vent à Taiwan lors d'un festival de cerfs-volants (vidéo)
https://www.francemusique.fr/savoirs-pratiques/en-grande-bretagne-pour-s-adapter-aux-mesures-sanitaires-les-orchestres-scolaires-se-mettent-a-l-ukulele-87033#Echobox=1599227562,"En Grande-Bretagne, les orchestres scolaires se mettent au ukulélé pour s'adapter aux mesures sanitaires"
https://actu.fr/occitanie/toulouse_31555/avocat-offusque-banquet-geant-cassoulet-place-capitole-porter-plainte_35911606.html,Toulouse. Un avocat qui se bat contre le port du masque obligatoire  s'offusque du banquet géant au cassoulet place du Capitole et veut porter plainte.
https://www.cnews.fr/monde/2020-09-03/des-pilotes-croisent-un-homme-en-jetpack-plus-de-1000-metres-daltitude-994543,Des pilotes croisent un homme en jetpack à plus de 1.000 mètres d’al­ti­tude
https://gamergen.com/actualites/insolite-doom-jouable-test-grossesse-315328-1,INSOLITE : Doom jouable sur un test de grossesse
https://www.liberation.fr/debats/2020/09/14/kamala-harris-est-elle-noire-telle-est-la-question_1799448,Kamala Harris est-elle noire ? Telle est la question...
https://www.sudouest.fr/2020/09/09/escroquerie-au-faux-le-drian-les-deux-complices-condamnes-a-7-et-10-ans-en-appel-7824244-4697.php,"Escroquerie au ""faux Le Drian"" : les deux complices condamnés à 7 et 10 ans en appel"
https://www.geo.fr/environnement/malaisie-il-perd-son-smartphone-et-le-retrouve-avec-les-selfies-dun-singe-202101,Malaisie : il perd son smartphone et le retrouve avec les selfies d’un singe
https://www.cnews.fr/vie-numerique/2020-09-15/un-homme-lance-une-partie-de-football-manager-pendant-son-mariage-998515,Un homme lance une partie de Football Manager pendant son mariage
https://www.estrepublicain.fr/insolite/2020/09/14/juif-et-gaze-aux-mots-croises-un-malheureux-hasard-assure-la-loterie,"Suisse : ""Juif"" et ""gazé"" aux mots croisés : un ""malheureux hasard"" assure la loterie"
https://www.lci.fr/police/darmanin-annonce-l-arrivee-de-nouvelles-grenades-pour-le-retour-des-gilets-jaunes-2164320.html,Darmanin annonce l'arrivée de nouvelles grenades pour le retour des Gilets jaunes
https://www.cnews.fr/monde/2020-09-11/coronavirus-un-bebe-ne-porte-pas-de-masque-dans-lavion-le-vol-est-annule-997443,"Coronavirus : Un bébé ne porte pas de masque dans l’avion, le vol est annulé"
https://www.sudouest.fr/2020/08/29/les-bons-plans-de-la-maison-d-arret-7788255-10413.php,"Saintes : ""C’est lamentable"", les plans de la prison diffusés en ligne lors d’un appel d’offres"
https://www.caradisiac.com/il-realise-le-tour-du-nurburgring-au-volant-d-un-tracteur-185106.htm#xtor=RSS-40,Il réalise le tour du Nürburgring au volant d'un tracteur
https://www.marianne.net/societe/je-ne-parle-pas-comme-ca-la-maison-enquete-sur-ces-bourgeois-qui-disent-wallah?Echobox=1599140137#xtor=CS2-4,"""Je ne parle pas comme ça à la maison"": enquête sur ces bourgeois qui disent ""wallah"""
https://www.francebleu.fr/infos/insolite/video-les-tong-decapsuleur-l-invention-de-l-ete-d-un-jeune-normand-1598023341,"La tong décapsuleur, l'invention de l'été d'un jeune Normand"
https://fr.metrotime.be/2020/08/20/must-read/le-cadavre-dun-employe-recouvert-de-parapluies-pour-que-le-magasin-reste-ouvert/,Le cadavre d'un employé recouvert de parapluies pour que le magasin reste ouvert
https://www.elle.fr/Societe/News/Le-pape-a-confie-avoir-ete-videur-en-boite-de-nuit-2640083,Le pape a confié avoir été videur en boîte de nuit
https://www.bfmtv.com/economie/consommation/ikea-va-vendre-des-boulettes-de-viande-sans-viande_AN-202007210027.html,Ikea va vendre des boulettes de viande sans viande
https://www.capital.fr/entreprises-marches/le-bonus-dun-patron-francais-sabre-apres-un-site-aborigene-dynamite-en-australie-1378532,"Un patron français doit renoncer à son bonus, après avoir fait dynamiter un site aborigène en Australie"
https://www.rtl.be/people/buzz/il-pleut-du-chocolat-en-suisse-a-cause-d-un-incident-dans-une-usine-1238610.aspx,Il pleut du chocolat en Suisse... à cause d’un incident dans une usine
https://www.lalibre.be/economie/conjoncture/des-grands-crus-francais-vont-etre-transformes-en-alcool-a-desinfecter-5f352365d8ad5862195d85c9,Des grands crus français vont être transformés en alcool à désinfecter
https://www.dhnet.be/actu/monde/bagarre-generale-au-mondial-de-petanque-une-equipe-belge-attaquee-c-etait-la-corrida-5f4cbb4a7b50a677fb45011c#.X03kR25bCzo.facebook,"Bagarre générale au Mondial de pétanque, une équipe belge attaquée: ""Ils se sont mis à courir après nous avec leurs boules"""
https://www.lci.fr/people/gad-elmaleh-prepare-un-album-de-reprises-de-claude-nougaro-2162706.html#Echobox=1598350296,Gad Elmaleh prépare un album de reprises de Claude Nougaro
https://www.courrierinternational.com/article/contagion-chanter-moins-fort-pourrait-reduire-les-risques-de-propagation-du-covid-19,Chanter moins fort pourrait réduire les risques de propagation du Covid-19
https://etudiant.lefigaro.fr/article/parcoursup-une-bacheliere-supprime-son-voeu-par-erreur-son-pere-entame-une-greve-de-la-faim_25972988-e3bc-11ea-8db3-6278ecdf2427/#Echobox=1598033128,"Parcoursup: une bachelière supprime son vœu par erreur, son père entame une grève de la faim"
https://www.science-et-vie.com/questions-reponses/le-niveau-des-mers-augmenterait-il-si-tout-le-monde-se-baignait-en-meme-temps-58406,Le niveau des mers augmenterait-il si tout le monde se baignait en même temps ? - Science & Vie
https://www.sciencesetavenir.fr/archeo-paleo/archeologie/les-moines-bretons-faisaient-deja-des-crepes-au-moyen-age_147048,Les moines bretons faisaient déjà des crêpes au Moyen-Âge
https://www.theglobeandmail.com/business/article-why-i-decided-to-take-the-word-chief-out-of-my-ceo-title-to-respect/,"Canada : ""Pourquoi j'ai décidé de supprimer le mot «chef» de mon titre de PDG par respect pour les indiens""."
https://www.courrierinternational.com/article/japon-tokyo-des-toilettes-transparentes-pour-rassurer-les-usagers-sur-leur-proprete,"À Tokyo, des toilettes transparentes pour rassurer les usagers sur leur propreté"
https://soirmag.lesoir.be/307071/article/2020-06-14/deux-detenus-sevadent-de-prison-mais-promettent-de-revenir-des-quils-ont-regle,Deux détenus s’évadent de prison mais promettent de revenir dès qu’ils ont réglé leurs problèmes familiaux
https://www.rtl.fr/actu/international/video-bresil-bolsonaro-confond-un-homme-nain-avec-un-enfant-et-le-porte-7800734612,Brésil : Bolsonaro confond un homme nain avec un enfant et le porte
https://www.parismatch.com/Actu/Insolite/Jair-Bolsonaro-confond-un-nain-avec-un-enfant-et-le-porte-sur-ses-epaules-1699509,Jair Bolsonaro confond un nain avec un enfant et le porte sur ses épaules
https://mobile.francetvinfo.fr/culture/arts-expos/des-nudistes-visiteront-l-exposition-de-funes-a-la-cinematheque-en-hommage-au-gendarme-de-saint-tropez-seul-le-masque-est-obligatoire_4065193.html#xtref=http://m.facebook.com/&xtref=https://www.francetvinfo.fr/culture/arts-expos/des-nudistes-visiteront-l-exposition-de-funes-a-la-cinematheque-en-hommage-au-gendarme-de-saint-tropez-seul-le-masque-est-obligatoire_4065193.html&xtref=https://mobile.francetvinfo.fr/culture/arts-expos/des-nudistes-visiteront-l-exposition-de-funes-a-la-cinematheque-en-hommage-au-gendarme-de-saint-tropez-seul-le-masque-est-obligatoire_4065193.html,"Des nudistes visiteront l'exposition De Funès à la Cinémathèque en hommage au ""Gendarme de Saint-Tropez"" : seul le masque est obligatoire"
https://www.lesnumeriques.com/vie-du-net/google-avoue-ne-rien-comprendre-a-ses-parametres-de-confidentialite-n153735.html,Google avoue ne rien comprendre à ses propres paramètres de confidentialité
https://www.courrierinternational.com/article/voyage-en-2021-une-ligne-de-bus-delhi-londres-la-plus-longue-du-monde?Echobox=1598350588,"En 2021, une ligne de bus Delhi-Londres, la plus longue du monde"
https://www.autonews.fr/actualite/soldes-2020-une-bugatti-chiron-offerte-pour-tout-achat-d-un-hyperyacht-xenos-91951,Soldes 2020 : une Bugatti Chiron offerte pour tout achat d’un hyperyacht Xenos !
https://www.leparisien.fr/culture-loisirs/tv/roselyne-bachelot-bientot-reine-du-shopping-sur-m-6-11-08-2020-8366517.php,Roselyne Bachelot bientôt « Reine du shopping » sur M 6
https://www.franceinter.fr/societe/sur-tiktok-des-jeunes-se-font-passer-pour-des-victimes-de-l-holocauste#Echobox=1598548487,"Sur TikTok, des jeunes se font passer pour des victimes de l'Holocauste"
https://www.leparisien.fr/societe/la-chaise-pliante-star-de-l-ete-dans-les-cites-23-08-2020-8371776.php,"La chaise pliante, star de l’été dans les cités"
https://www.francebleu.fr/infos/medias-people/dordogne-michel-drucker-dejeune-a-perigueux-1597826335,Dordogne : Michel Drucker déjeune à Périgueux
https://www.lepoint.fr/sciences-nature/ecosse-en-courant-une-paleontologue-butte-sur-un-os-de-dinosaure-27-08-2020-2389157_1924.php,"Écosse : en courant, une paléontologue bute contre un os de dinosaure"
https://www.rtl.be/people/buzz/sandro-39-ans-s-est-fait-couper-les-oreilles-j-en-avais-envie--1240557.aspx,"Sandro, 39 ans, s'est fait couper les oreilles: ""Mes amis ont essayé de m'en dissuader mais j'en avais envie"""
https://korii.slate.fr/et-caetera/armee-etats-unis-us-navy-booming-beaver-plus-petit-navire-bateau-remorqueur#Echobox=1598945687,"Le «Booming Beaver», plus petit navire de l'US Navy"
https://www.cnews.fr/monde/2020-08-28/alors-que-les-rumeurs-le-disaient-dans-le-coma-kim-jong-un-reapparait-dans-un,"Alors que les rumeurs le disaient dans le coma, Kim Jong-un réapparaît dans un champs de maïs"
https://www.bfmtv.com/auto/agace-par-sa-femme-il-l-abandonne-sur-une-aire-d-autoroute_AN-202008050056.html,"Agacé par sa femme, il l'abandonne sur une aire d'autoroute"
https://actu.orange.fr/france/huit-fois-en-trois-ans-ce-peintre-en-batiment-repeint-la-mauvaise-maison-magic-CNT000001skO0u.html,"Huit fois en trois ans, ce peintre en bâtiment repeint la mauvaise maison"
https://www.bfmtv.com/grand-littoral/royaume-uni-un-depute-propose-de-recuperer-calais-pour-empecher-les-traversees-des-migrants_AV-202008150079.html,Royaume-Uni : un député propose de récupérer Calais pour empêcher les traversées des migrants
https://hitek.fr/42/allen-pan-pistolet-masque-tete-gens_8111,WTF : il a créé un pistolet pour tirer des masques sur la tête des gens qui n'en portent pas
https://www.midilibre.fr/2020/08/06/les-restes-dun-masque-chirurgical-retrouve-dans-le-menu-mcdo-dune-fillette-de-6-ans-9009852.php,Une fillette s'étouffe avec les restes d'un masque chirurgical mélangé à ses nuggets chez McDo
https://www.leparisien.fr/amp/societe/un-nudiste-allemand-poursuit-un-sanglier-qui-lui-a-vole-son-sac-et-devient-une-icone-09-08-2020-8365539.php,Un nudiste allemand poursuit un sanglier qui lui a volé son sac... et devient une icône
https://www.capital.fr/economie-politique/ouistreham-elle-enleve-son-masque-pour-manger-une-gaufre-et-paie-135-euros-damende-1378499,Ouistreham : elle enlève son masque pour manger une gaufre et paie 135 euros d’amende
https://www.ouest-france.fr/grand-est/metz/metz-les-soignants-auront-droit-a-un-vol-en-montgolfiere-gratuit-lors-des-montgolfiades-6942122,Metz. Les soignants auront droit à un vol en montgolfière gratuit
https://www.rtl.fr/actu/insolite/nimes-un-conducteur-de-tgv-rate-la-gare-et-fait-machine-arriere-7800756154,Nîmes : un conducteur de TGV rate la gare et fait machine arrière
https://www.caradisiac.com/elle-reussit-son-permis-apres-17-tentatives-en-12-ans-184913.htm#xtor=RSS-40,Elle réussit son permis après 17 tentatives en 12 ans
https://www.leparisien.fr/info-paris-ile-de-france-oise/transports/il-enleve-son-masque-dans-la-gare-de-lyon-pour-manger-un-kinder-et-se-prend-une-amende-01-09-2020-8376672.php,Il enlève son masque dans la gare de Lyon pour manger un Kinder... et se prend une amende
https://www.letelegramme.fr/finistere/brest/227-tests-d-alcoolemie-effectues-durant-le-week-end-en-pays-de-brest-zero-resultat-positif-31-08-2020-12606800.php#Echobox=1598876216,227 tests d’alcoolémie effectués durant le week-end en Pays de Brest : zéro résultat positif
https://www.rtl.be/people/buzz/-2020-n-a-pas-ete-la-meilleure-annee-le-marie-lache-ces-mots-et-la-foudre-interrompt-la-ceremonie-video--1240580.aspx,"""2020 n'a pas été la meilleure année"": le marié lâche ces mots et la foudre interrompt la cérémonie (vidéo)"
https://www.capital.fr/economie-politique/deux-emeus-vires-dun-hotel-en-australie-1376985,Deux émeus virés d’un hôtel en Australie
https://www.numerama.com/tech/641886-apple-veut-faire-croire-que-le-logo-poire-dune-pme-de-recettes-de-cuisine-peut-tromper-ses-clients.html,Apple veut interdire le logo poire d'une app de recettes de cuisine
https://www.lemonde.fr/big-browser/article/2020/08/13/pour-avoir-des-cheveux-parfaits-donald-trump-est-pret-a-assouplir-une-loi-sur-la-consommation-d-eau_6048900_4832693.html,"Pour avoir des cheveux « parfaits », Donald Trump est prêt à assouplir une loi sur la consommation d’eau"
