https://www.nouvelobs.com/justice/20190529.OBS13684/proces-balkany-je-suis-un-escroque.html#Echobox=1559155845,Procès Balkany : « Je suis un escroqué ! »
https://www.bbc.com/news/world-us-canada-48454674,US energy department rebrands gas exports 'molecules of freedom'
https://intrld.com/ikea-salon-simpsons-friends/,Ikea propose une gamme pour recréer le salon des Simpson ou Friends
http://www.leparisien.fr/faits-divers/explosion-a-lyon-hichem-n-est-pas-du-tout-extremiste-confie-son-meilleur-ami-27-05-2019-8081256.php,"Explosion à Lyon : «Hichem n’est pas du tout extrémiste», confie son meilleur ami"
https://www.lemonde.fr/livres/article/2019/05/29/l-illustrateur-pascal-somon-condamne-a-la-prison-avec-sursis-pour-avoir-dessine-tintin_5468976_3260.html#Echobox=1559116774,L’illustrateur Pascal Somon condamné à la prison avec sursis pour avoir dessiné Tintin
https://www.marianne.net/societe/attentat-colis-piege-lyon-amazon#Echobox=1559058900,Attentat au colis piégé à Lyon : comment le suspect s'est fait trahir par la marque de ses piles Amazon
https://hitek.fr/42/roomba-michael-reeves-youtube-hack_6698,Un Youtubeur modifie son robot aspirateur pour qu'il crie de douleur lorsqu'il se cogne
https://www.francetvinfo.fr/sports/sports-extremes/trois-nouveaux-morts-sur-l-everest-apres-de-longs-embouteillages-pour-gravir-la-montagne_3458283.html,Les embouteillages au sommet de l'Everest ont fait sept morts parmi les alpinistes
http://www.slate.fr/story/176646/origine-mots-sexe-feminin-domination-patriarcale,"«Clitoris», «vagin» et «utérus» sont des termes sexistes"
https://www.marianne.net/politique/une-deputee-lrem-se-sert-de-mails-collectes-pendant-le-grand-debat-pour-faire-campagne-aux,Une députée LREM se sert de mails collectés pendant le Grand débat pour faire campagne aux européennes
http://madame.lefigaro.fr/societe/marlene-schiappa-soppose-a-la-greve-du-sexe-lancee-par-alyssa-milano-ivg-avortement-130519-165059?fbclid=IwAR3iijkl5dHaA65iBpy9VYKNNRyw_nZemOdgpdDaVI9PDOkm8MptTcHaEj4,"Marlène Schiappa : ""Faire la grève du sexe c’est aussi se priver soi-même"""
http://edito.lefigaro.fr/secteur/high-tech/2016/10/19/32001-20161019ARTFIG00157-le-porte-biberon-pour-smartphone-est-ne.php?fbclid=IwAR153GijdklPuDKiSygHRU7EyDH7SFhbF0G0FzpZILxuwO1KdaQolqqlxZk,Le porte-biberon pour smartphone est né
https://www.marianne.net/monde/summum-de-la-desillusion-alexis-tsipras-s-affiche-la-une-du-financial-times-pour-promettre,"Alexis Tsipras s'affiche à la une du Financial Times pour promettre ""plus de réformes"" néolibérales"
https://www.20minutes.fr/societe/2487255-20190402-auchan-reconnait-avoir-vendu-sacoches-croix-gammee-pologne?xtref=facebook.com&fbclid=IwAR0F0wmXfnvWJguqQQUV2wXmUktA1MXLcmzNHbeo7coRUsO8tQC6apECceA#Echobox=1554211350,Auchan reconnaît avoir vendu des sacoches avec une croix gammée en Pologne
http://www.leparisien.fr/elections/europeennes/europeennes-le-jeu-video-ou-loiseau-affronte-melenchon-represente-en-insecte-russe-10-05-2019-8069151.php,Européennes : le jeu vidéo où Loiseau affronte Mélenchon représenté en insecte russe
https://rmc.bfmtv.com/emission/je-me-suis-reveillee-a-4h-du-matin-pour-regarder-game-of-thrones-raconte-marlene-schiappa-1695456.html#content/contribution/edit,"« Je me suis réveillée à 4h du matin pour regarder Game of Thrones », raconte Marlène Schiappa"
http://www.lefigaro.fr/voyages/sncf-jusqu-a-27-d-augmentation-avec-la-carte-de-reduction-liberte-20190529,SNCF : jusqu’à 27% d’augmentation avec la carte de réduction Liberté
https://www.vogue.fr/joaillerie/article/quels-bijoux-jet-set-porter-sur-un-yacht-kendall-jenner-bella-hadid,Quels bijoux jet-set porter sur un yacht cet été ?
https://www.h24info.ma/videos/photo-du-jour/quand-cnews-confond-nasser-al-khelaifi-avec-jamal-abdel-nasser/,Quand CNews confond Nasser Al Khelaifi avec Jamal Abdel Nasser
http://www.lefigaro.fr/secteur/high-tech/2018/07/06/32001-20180706ARTFIG00339-un-algorithme-de-facebook-censure-la-declaration-d-independance-des-etats-unis.php,Un algorithme de Facebook censure la Déclaration d'Indépendance des États-Unis
https://www.ulyces.co/news/cette-femme-se-fait-hypnotiser-pour-soigner-sa-phobie-de-michael-jack%C2%AD%C2%ADson/,Cette femme se fait hypnotiser pour soigner sa phobie de Michael Jack­­son
https://www.bfmtv.com/politique/nicolas-sarkozy-estime-qu-il-va-peut-etre-etre-oblige-de-revenir-1584775.html,Nicolas Sarkozy estime qu'il va « peut-être être obligé de revenir »
https://www.rtl.fr/actu/international/climat-66-tonnes-d-excrements-d-alpinistes-menacent-de-degeler-en-alaska-7797384473?fbclid=IwAR0F0wmXfnvWJguqQQUV2wXmUktA1MXLcmzNHbeo7coRUsO8tQC6apECceA,Climat : 66 tonnes d’excréments d'alpinistes menacent de dégeler en Alaska
https://www.bfmtv.com/tech/uber-lance-une-option-pour-demander-au-chauffeur-de-se-taire-1692140.html#,Uber lance une option pour demander au chauffeur de se taire
https://www.europe1.fr/societe/bordeaux-un-passage-pieton-dedie-aux-lgbt-degradepar-des-lgbt-3899663?fbclid=IwAR1Q4kb56mnqLaLJ0mrXi9JpKjnfFZGYXswsLxkRR_pEotmUIU0rO0RuCwY#utm_medium=Social&xtor=CS1-15&utm_source=Facebook&Echobox=1558357194,Bordeaux : un passage piéton dédié aux LGBT dégradé par une association LGBT radicale
http://fr.traxmag.com/article/51380-teknival-les-excrements-des-fetards-obligent-des-militaires-a-annuler-un-saut-en-parachute?fbclid=IwAR2eiSkud47ffwUpQe-xQMAyYOJvVYFQD43hRAkdT0DIJf0rjS-QecDcUHc,Teknival : Les excréments des fêtards obligent des militaires à annuler un saut en parachute
https://www.marianne.net/monde/en-italie-le-m5s-veut-interdire-les-paupiettes-de-chat-et-de-chien?fbclid=IwAR2gwGa_duaXG7L7WknXdyGT1yMARYysJzddgzDVruv3ZlVJEys6LgyhNNg#Echobox=1558452683,"En Italie, le M5S veut interdire... les paupiettes de chat et de chien"
http://www.lefigaro.fr/secteur/high-tech/la-chine-attribue-une-sonnerie-de-telephone-speciale-aux-citoyens-endettes-20190521#Echobox=1558472978,La Chine attribue une sonnerie de téléphone spéciale aux citoyens endettés
https://www.huffingtonpost.fr/entry/game-of-thrones-saison-8-episode-6-a-bordeaux-la-fin-a-ete-spoilee-sur-des-affiches_fr_5ce345f1e4b0877009936226?ncid=fcbklnkfrhpmg00000001,"""Game of Thrones"" saison 8 épisode 6: à Bordeaux, la fin a été spoilée sur des affiches"
https://www.20minutes.fr/arts-stars/culture/2519083-20190516-lapin-jeff-koons-vendu-911-millions-dollars-record-artiste-vivant?fbclid=IwAR05xNhCDadKEoLz0TVmJpy5p7-ooyGXPoviizmcDGESYvoIJrgJBy7vH_U,"Jeff Koons a vendu 91,1 millions de dollars un lapin"
https://www.parisdepeches.fr/2-Societe/2048-France/13487-Motos_deputes_LaRem_proposent_gilet_jaune_obligatoire.html?fbclid=IwAR2IZN-yJQ4U90htsYOMo5bOyQCsVlkLdA6roLV3ugNI_DaqQBzmnByxZA4,Motos : des députés LaRem proposent le gilet jaune obligatoire
https://www.lci.fr/justice/masturbation-dans-un-castorama-l-eurodepute-modem-robert-rochefort-plaide-coupable-2011883.html,Masturbation dans un Castorama : l’eurodéputé MoDem Robert Rochefort plaide coupable
https://www.ouest-france.fr/europe/allemagne/des-zones-reservees-aux-dealers-dans-un-parc-font-polemique-berlin-6342726?fbclid=IwAR2QZ9BeGBBvXfWgUTtz9mpLtE06rkLrb-8Dpw1cT2Lx6N8XQJYM8s0PxkU#Echobox=1557409080,Des zones réservées aux dealers dans un parc font polémique à Berlin
https://www.msn.com/fr-fr/video/viral/une-jeune-youtubeuse-soffre-une-bmw-%C3%A0-190-000-dollar-pour-ses-12-ans/vi-AABr5ig?ocid=spartandhp&fbclid=IwAR06Xhfq2Tu7pGwEIj4T8oLtynXbnaLuHmaBHQLWk1uV-b07wmntqUQx8Bo,"À 12 ans, une Youtubeuse s'offre sa voiture de luxe"
https://www.bfmtv.com/international/pour-un-discours-sur-les-inegalites-hillary-clinton-portait-une-veste-armani-a-12-495-dollars-981521.html,"Lors d'un discours sur les inégalités, Hillary Clinton portait une veste Armani à 12.495 dollars"
https://limportant.fr/infos-monde/3/476766,Chine : reconnaissance faciale des vaches et des cochons
https://www.ouest-france.fr/societe/non-additionner-les-cartes-2-et-4-au-uno-n-est-pas-autorise-6339448,"Non, additionner les cartes +2 et +4 au Uno n’est pas autorisé"
https://www.courrierinternational.com/article/religion-rassemblement-inedit-au-congres-des-exorcistes-rome?Echobox=1557238810,Rassemblement inédit au congrès des exorcistes à Rome
https://www.lest-eclair.fr/id62846/article/2019-05-06/luke-perry-ete-inhume-dans-un-costume-biodegradable-en-champignons?fbclid=IwAR3rSY07DVSaSfqK0-7fYAF9lE1eJupzvkgXuFAEPNgde4PRZWxbCOHymhE,Luke Perry a été inhumé dans un costume biodégradable à base de champignons
https://www.francetvinfo.fr/animaux/les-etats-unis-parachutent-des-souris-a-guam-pour-tuer-des-serpents_473900.html?fbclid=IwAR1KE3KKRCACQIRqNzLgIxuP9yi1btKHMdgyG_6nzwiu7n6KzfwidwEiz3k,Les Etats-Unis parachutent des souris à Guam pour tuer des serpents
https://www.witfm.fr/news/une-blogueuse-beaute-se-fait-devorer-le-visage-par-un-poulpe-video-13074,Une blogueuse beauté se fait dévorer le visage par un poulpe
https://www.lesnumeriques.com/jouet/e-stiq-e-stiq-v1-p52363/e-stiq-francais-inventent-baton-quidditch-pour-route-n85915.html#Echobox=1558217047,E-STIQ : des Français inventent le bâton de Quidditch pour route
https://lexpansion.lexpress.fr/high-tech/du-maquillage-pour-tromper-les-logiciels-de-reconnaissance-faciale_1930781.html?fbclid=IwAR06Xhfq2Tu7pGwEIj4T8oLtynXbnaLuHmaBHQLWk1uV-b07wmntqUQx8Bo#lzIVZCPacCMdvw2i.01,Du maquillage pour tromper les logiciels de reconnaissance faciale
http://www.slate.fr/story/177336/drogue-cocaine-ethique-payer-plus-cher?fbclid=IwAR1xphItQJCuglUDYboXu5A4uLsqHddRCVkGEjXDOMLF7ksowQcLUchMp-8,Les gens sont prêts à payer plus cher pour avoir une cocaïne éthique
https://www.ouest-france.fr/politique/patrick-balkany/le-portable-de-patrick-balkany-sonne-au-tribunal-sur-la-musique-des-tontons-flingueurs-6351594?fbclid=IwAR19g4loRISRbfYoeXjcHjY04H0amZ305aHSBaTaoft_Emsk5JN9ljiLzh0,Le portable de Patrick Balkany sonne en plein tribunal avec la musique des Tontons Flingueurs
https://ici.radio-canada.ca/nouvelle/1167739/consommer-placenta-gelule-manger-accouchement?fbclid=IwAR1JCz1ojuGXSe_f5fN4CD0sS3pFeTRsa466Fb_6WNAYa4egN45qTlbI2fE,Manger son placenta serait une mauvaise idée | ICI
https://www.cnews.fr/divertissement/2019-05-14/got-les-parents-qui-ont-appele-leur-fille-daenerys-confrontes-levolution?fbclid=IwAR3yxe1B0_RC71zxgATU39nnv5Khl4bUe_Uadi_KfBnF3eiHdit-fVDJRkE,GoT : les parents qui ont appelé leur fille Daenerys confrontés à l'évolution du personnage
https://www.ulyces.co/news/le-beluga-soupconne-detre-un-espion-russe-serait-un-therapeute-pour-enfants/,Le béluga soupçonné d'être un espion russe serait un thérapeute pour enfants
https://www.lavoixdunord.fr/545205/article/2019-03-01/les-entreprises-preferent-des-jeunes-de-18-ans-avec-dix-ans-d-experience,«Les entreprises préfèrent des jeunes de 18 ans avec dix ans d’expérience»
https://www.bfmtv.com/international/bresil-le-perroquet-des-dealers-crie-maman-la-police-devant-les-autorites-il-est-place-en-detention-1680171.html?fbclid=IwAR3PYLOIgqfAtYPG9HFxM9zof0ZRqrA_eGSdM6PYSSTEP_CoTAq3d3LB0bg#page/contribution/index,"Brésil: le perroquet des dealers crie « Maman, la police! » devant les autorités, il est placé en détention"
http://m.leparisien.fr/societe/arabie-saoudite-elle-oublie-son-bebe-a-l-aeroport-son-avion-fait-demi-tour-12-03-2019-8029875.php,"Arabie saoudite : elle dit avoir oublié son bébé à l’aéroport, l’avion fait demi-tour"
http://www.leparisien.fr/societe/un-pigeon-flashe-en-exces-de-vitesse-08-05-2019-8068023.php,Un pigeon flashé en excès de vitesse
https://www.konbini.com/fr/techetinnovation/piratage-trottinettes-lime-se-mettent-a-raconter-obscenites?fbclid=IwAR3PYLOIgqfAtYPG9HFxM9zof0ZRqrA_eGSdM6PYSSTEP_CoTAq3d3LB0bg#post-content,Piratage : des trottinettes Lime se mettent à raconter des obscénités
https://soirmag.lesoir.be/221607/article/2019-05-01/game-thrones-les-gens-ne-savent-pas-regler-leur-tele-le-chef-doperation-repond,"« Game of Thrones » : « Les gens ne savent pas régler leur télé », le chef d’opération répond aux fans qui se plaignent du manque de luminosité"
https://www.cnews.fr/monde/2019-05-08/il-sendort-avec-ses-airpods-sur-les-oreilles-et-se-reveille-avec-un-ecouteur-dans,Il s'endort avec ses AirPods sur les oreilles et se réveille avec un écouteur dans le ventre qui fonctionne
https://www.lemonde.fr/international/article/2019/04/13/pays-bas-l-ex-directeur-d-une-banque-de-sperme-a-eu-49-enfants-biologiques_5449798_3210.html?fbclid=IwAR3M_1KGb63YhtKO6bsscJ85X1vDGQQ2Q09qIcZ2yWmjVZIlK7Tqk_ziQVk,Pays-Bas : l’ex-directeur d’une banque de sperme a eu 49 enfants biologiques
https://fr.sputniknews.com/canada/201904301040934870-trudeau-confond-japon-chine-shinzo-abe/,Trudeau confond le Japon et la Chine devant Shinzo Abe... deux fois
https://www.lest-eclair.fr/id57982/article/2019-04-14/le-fisc-americain-laffut-du-bebe-royal-de-harry-et-meghan,Le fisc américain à l’affût du bébé royal de Harry et Meghan
https://www.numerama.com/pop-culture/510876-game-of-thrones-oui-un-gobelet-starbucks-a-bien-ete-oublie-dans-une-scene.html?fbclid=IwAR25MYq1qDtI53A6Q-txDBKTGAmtfyBR9FTeN2V11JgofHMcn3bO-yIMYcI,« On est désolés ! » : la productrice de Game of Thrones revient sur gobelet Starbucks oublié
https://www.ulyces.co/news/amazon-utilise-une-ia-qui-licencie-automatiquement-les-ouvriers/?fbclid=IwAR29EHemPJti9RpdXKw2I2RM_YkdYsg5otdXewi6wgWTkZ_iCzBNXp8Tywc,Amazon utilise une IA qui licencie automatiquement les ouvriers
https://www.lejdd.fr/Societe/christophe-barbier-se-confronter-au-terrain-pollue-lesprit-de-leditorialiste-3294632.amp?fbclid=IwAR3nLE2PDyCCujxMb1RX1ynkMIzdQb2S0hnp7PLUVT4R3fNuzaCi8Svb0t4,"Christophe Barbier : ""Se confronter au terrain pollue l’esprit de l’éditorialiste"""
https://www.lemonde.fr/planete/video/2019/04/05/transformer-des-homards-en-matiere-plastique_5446476_3244.html?fbclid=IwAR2-Ko6Xh6FCtNkTq6_gSUErl6l9uIRVVAVL-XObu7HMYOvCbxTzq2JiQBc,Transformer des homards en matière plastique
https://www.closermag.fr/people/video-j-ai-vu-un-objet-rectangulaire-tres-lumineux-nelson-monfort-se-confie-sur-963956?fbclid=IwAR3EkKFWfNubotrVgFXMqnZyYiLLxguLOye2yiXDveLcq1k_VRjf3Kwsxn4,J'ai vu un objet rectangulaire très lumineux : Nelson Monfort se confie sur sa rencontre avec les extraterrestres
http://www.leparisien.fr/faits-divers/venue-de-macron-et-du-president-italien-a-amboise-les-riverains-pourront-finalement-ouvrir-leurs-fenetres-30-04-2019-8063154.php?fbclid=IwAR0GCVdKRhOuvRUU7b3be4cJzPenGLCfGD0uMWFCSkDiKxuVP5G5M2SRRVM#xtor=AD-1481423552,Venue de Macron à Amboise : les riverains pourront finalement ouvrir leurs fenêtres
https://www.ulyces.co/news/les-crevettes-anglaises-testees-positives-a-la-cocaine/?fbclid=IwAR0_nWYNRsWD9ksXzsS4CnmtzlBzbsvbI75Ne89uFIL3Yvz14jcJ5Ihtxu4,Les crevettes des rivières anglaises testées positives à la cocaïne
http://m.leparisien.fr/essonne-91/essonne-le-trajet-paris-corbeil-a-gagne-8-minutes-en-178-ans-27-03-2019-8041194.php?fbclid=IwAR3EkKFWfNubotrVgFXMqnZyYiLLxguLOye2yiXDveLcq1k_VRjf3Kwsxn4,Rer d : le trajet paris-corbeil a gagné 8 minutes en 178 ans
http://www.lefigaro.fr/musique/pete-doherty-hospitalise-apres-une-attaque-d-un-herisson-sauvage-20190502,Pete Doherty hospitalisé après une attaque d’un hérisson sauvage
https://www.cnews.fr/monde/2019-04-29/crashs-de-boeing-737-max-lentreprise-avait-desactive-un-signal-dalerte-pour-le,Crashs de Boeing 737 MAX : l’entreprise avait désactivé un signal d’alerte pour le rendre optionnel et payant
https://people.bfmtv.com/mode/louis-sarkozy-lance-une-collection-de-mocassins-inspiree-de-grands-philosophes-et-penseurs-1674964.html?fbclid=IwAR0l54IcVzCjEPgqRM4hPHpt3jfy-NUM8kp6AsbLNmPJgeJuKYyrQgPnTOU,Louis Sarkozy lance une collection de mocassins inspirée « de grands philosophes et penseurs »
https://www.huffingtonpost.fr/entry/rapport-sur-la-biodiversite-noublions-pas-les-especes-moches_fr_5cd06d35e4b0548b735df919?ncid=tweetlnkfrhpmg00000001,"Rapport sur la biodiversité: n'oublions pas les espèces ""moches"""
https://www.oklm.com/video/des-etudiants-inventent-une-poignee-anti-microbes-pour-la-barre-du-metro/,Des étudiants inventent une poignée anti-microbes pour la barre du métro
http://m.leparisien.fr/environnement/le-compost-humain-une-alternative-ecologique-aux-funerailles-classiques-29-04-2019-8062881.php?fbclid=IwAR0uNcMSpmMF7POW4fQb_uP7ozHkp4CbbYb4xvqcw-gwIxxxlxDvn9CZzdE,"Transformer le corps humain en compost, une alternative aux funérailles classiques"
http://m.leparisien.fr/societe/exclu-temporairement-du-college-hugo-a-joue-toute-la-journee-sur-l-ordinateur-12-04-2019-8051631.php?fbclid=IwAR0GCVdKRhOuvRUU7b3be4cJzPenGLCfGD0uMWFCSkDiKxuVP5G5M2SRRVM,"Exclu temporairement du collège, hugo a «joué toute la journée sur l’ordinateur»"
https://lexpansion.lexpress.fr/entreprises/pour-recruter-plus-facilement-les-restaurateurs-envisagent-de-mieux-payer-leurs-salaries_2073058.html?fbclid=IwAR2zaR9_T_w9WqMkZAc9V25qiajeivcr3UZCMzCAHf0TQq1TaNv1PjgdKIE,"Pour recruter plus facilement, les restaurateurs envisagent de mieux payer leurs salariés"
http://www.lefigaro.fr/cinema/avengers-endgame-des-profs-menacent-de-reveler-la-fin-du-film-pour-calmer-leurs-eleves-20190506?fbclid=IwAR0gB6pIDuMwnPnvG5L2zeKOo71hqQrIe2hRDxGe4bmz0NTNotLwfFxm4nI#Echobox=1557135923,Avengers – Endgame : des profs menacent de révéler la fin du film pour calmer leurs élèves
https://www.aufeminin.com/news-societe/lapidation-le-sultanat-de-brunei-appelle-l-ue-a-se-montrer-tolerante-s4000503.html,Lapidation : le sultanat de Brunei appelle l'UE à se montrer tolérante
https://www.europe1.fr/insolite/en-norvege-un-beluga-au-comportement-suspect-soupconne-detre-au-service-de-la-russie-3895868?fbclid=IwAR2XhVXZHiXI5X6kglBDE0yQGhjr1Ssk33dryweaMXCzUr0uuq9l_xE8AFE,"En Norvège, un béluga au comportement suspect soupçonné d'être au service de la Russie"
https://www.sudinfo.be/id116656/article/2019-05-03/selon-sa-mere-greta-thunberg-verrait-le-co2-loeil-nu,"Selon sa mère, Greta Thunberg verrait le CO2 à l’oeil nu"
https://www.bfmtv.com/police-justice/nouvelles-revelations-sur-le-passif-d-alexandre-benalla-au-ps-1676279.html?fbclid=IwAR3V9PNmrKgWTbW-HMWXpZ1RRFAPJfMoTAkYWOzEHffpEQwH6HoYEPUnIRA,« Je me suis fait enfumer »: comment Benoît Hamon a permis à Alexandre Benalla d'obtenir un badge d'accès à l'Assemblée
http://m.rfi.fr/ameriques/20151225-air-pur-canada-vendu-bouteille-chinois-pollution-pekin-vitality-air?fbclid=IwAR1Cm-1RaF00Erg_wqHdjGgdmXII604NZxK6VqprOBhIo6g6htu6c5Y1YMs&ref=fb,L’air pur du Canada vendu en bouteille aux Chinois
https://www.bfmtv.com/politique/marlene-schiappa-a-refuse-de-participer-a-l-emission-fort-boyard-1680012.html#utm_medium=Social&utm_source=Twitter&Echobox=1556186971,Marlène Schiappa a refusé de participer à l'émission Fort Boyard
https://www.ouest-france.fr/pays-de-la-loire/mayenne-53100/en-mayenne-une-pilule-pour-parfumer-ses-pets-au-muguet-6321885#Echobox=1556112697,Il invente une pilule pour parfumer les pets au muguet
https://www.lci.fr/population/paris-accuse-de-racisme-un-restaurant-retire-de-sa-carte-la-salade-tching-tchong-2119882.html,"Paris : accusé de racisme, un restaurant retire de sa carte la salade ""tching tchong"""
https://www.lalibre.be/actu/international/le-pape-francois-demande-aux-coiffeurs-et-estheticiennes-d-eviter-les-potins-5cc706539978e25347c5bb72,Le pape François demande aux coiffeurs et esthéticiennes d'éviter les potins
https://www.cnews.fr/monde/2019-04-05/lue-veut-remplacer-lappellation-burger-vegetarien-par-disque-vegetarien-827657,L'UE veut remplacer l'appellation «burger végétarien» par «disque végétarien»
https://www.huffingtonpost.fr/entry/critiquer-raphaele-rabatel-a-la-fdj-dessert-le-feminisme-pour-le-gouvernement_fr_5cb05ee7e4b082aab083e75c,"Critiquer Raphaële Rabatel à la FDJ ""dessert"" le féminisme selon le gouvernement"
"https://www.ladepeche.fr/2019/03/23/petanque-les-joueurs-qui-consomment-de-lalcool-sont-desormais-exclus-des-tournois,8086429.php#xtor=[[DDM-PRINCIPAL]]",Révolution sur les boulodromes: des contrôles d'alcoolémie aux concours de pétanque
https://www.francetvinfo.fr/culture/spectacles/humour/royaume-uni-un-humoriste-meurt-sur-scene-le-public-croit-a-un-sketch-et-continue-de-rire_3396225.html?Echobox=1555149122#xtor=CS1-746,"Royaume-Uni : un humoriste meurt sur scène, le public croit à un sketch et continue de rire"
http://www.lefigaro.fr/actualite-france/affaire-legay-la-policiere-chargee-de-l-enquete-est-la-compagne-du-commissaire-mis-en-cause-20190409,Affaire Legay : la policière chargée de l’enquête est la compagne du commissaire mis en cause
https://www.20minutes.fr/monde/2482603-20190327-etats-unis-met-lsd-cafe-eau-collegues-lutter-contre-energies-negatives?xtref=facebook.com#Echobox=1553691848,Etats-Unis: Il met du LSD dans le café et l’eau de ses collègues pour lutter contre leurs « énergies négatives »
http://www.lefigaro.fr/secteur/high-tech/lutte-contre-les-fake-news-twitter-bloque-une-campagne-du-gouvernement-francais-20190402,Lutte contre les «fake news» : Twitter bloque une campagne du gouvernement français
https://www.courrierinternational.com/article/enquete-pour-la-mafia-italienne-la-mozzarella-est-plus-rentable-que-la-cocaine?fbclid=IwAR0i5Wn8NJwXKYDO8o716lT5yFELvIZayJFulaTuScqer1rCLdQ2_ir20j8,"Pour la mafia italienne, la mozzarella est plus rentable que la cocaïne"
http://www.slate.fr/story/174588/chantre-finance-ethique-inculpe-affaire-corruption-universitaire#Echobox=1552562732,Un chantre de la finance éthique inculpé dans l'affaire de corruption universitaire américaine
https://www.bfmtv.com/tech/ce-service-vous-propose-de-payer-des-gens-pour-manifester-a-votre-place-1679316.html,Etre payé pour manifester à la place d'un autre: l'étonnant service d'une start-up française
https://www.rtl.fr/culture/super/avengers-4-bouleversee-une-femme-est-hospitalisee-apres-la-projection-du-film-7797521415,"""Avengers 4"" : bouleversée, une femme est hospitalisée après la projection du film"
http://www.francesoir.fr/culture-cinema/il-spoile-avengers-endgame-dans-le-cinema-et-se-fait-tabasser-par-des-fans,"Il spoile ""Avengers Endgame"" dans le cinéma et se fait tabasser par des fans"
https://www.la-croix.com/France/Il-echappe-guerre-Syrie-perd-oeil-France-2019-04-26-1301018034,Il échappe à la guerre en Syrie et perd un oeil en France
https://www.glamourparis.com/societe/travail/articles/etude-se-forcer-a-sourire-au-travail-pousserait-a-la-consommation-dalcool/73988,Étude : se forcer à sourire au travail pousserait à la consommation d’alcool
http://lavdn.lavoixdunord.fr/558934/article/2019-03-27/un-banc-s-effondre-pendant-la-presentation-de-la-liste-lrem,Européennes: Un banc s’effondre pendant la présentation de la liste LREM
https://www.courrierinternational.com/article/temoignage-pourquoi-il-est-difficile-de-se-faire-des-amis-chinois?Echobox=1556013295,Pourquoi il est difficile de se faire des amis chinois
https://www.cnews.fr/culture/2019-04-16/lemission-noubliez-pas-les-paroles-chante-allumer-le-feu-et-belle-pendant,L’émission «N’oubliez pas les paroles» chante «Allumer le feu» et «Belle» pendant l’incendie de Notre-Dame
http://www.lefigaro.fr/secteur/high-tech/en-estonie-une-intelligence-artificielle-va-rendre-des-decisions-de-justice-20190401#Echobox=1554365397,"En Estonie, une intelligence artificielle va rendre des décisions de justice"
https://www.ledauphine.com/france-monde/2017/03/08/le-depute-lr-anti-fraude-avait-un-compte-en-suisse,Le député LR anti-fraude avait un compte en Suisse
https://www.gala.fr/l_actu/news_de_stars/rachida-dati-accueillie-comme-une-star-a-barbes-meme-les-pickpockets-veulent-leur-selfie_427758,Rachida Dati accueillie comme une star à Barbès : même les pickpockets veulent leur selfie !
http://www.francesoir.fr/lifestyle-vie-quotidienne/vegan-il-prepare-du-boudin-noir-avec-son-propre-sang-video,"Végan, il prépare du boudin noir avec son propre sang"
https://www.letelegramme.fr/cotes-darmor/dinan/dinan-francois-hollande-accueilli-comme-une-rock-star-28-03-2019-12244777.php#Echobox=1553787328,Dinan. François Hollande accueilli comme une rock star
https://www.lci.fr/people/divorce-au-bout-de-4-jours-nicolas-cage-s-est-marie-sur-un-coup-de-tete-a-las-vegas-avec-erika-koike-car-il-etait-trop-saoul-2116887.html#Echobox=1553874317,"Divorce au bout de 4 jours : Nicolas Cage s'est marié ""sur un coup de tête"" car il était ""trop saoul"""
http://www.leparisien.fr/politique/marlene-schiappa-si-vous-voulez-faire-parler-d-un-sujet-politique-il-faut-mettre-cyril-hanouna-dedans-31-03-2019-8043423.php#xtor=AD-1481423553,"Marlène Schiappa : «Si vous voulez faire parler d’un sujet politique, il faut mettre Cyril Hanouna dedans»"
https://www.lexpress.fr/actualite/societe/justice/en-10-ans-claude-gueant-n-a-retire-que-800-euros-de-son-compte_1954290.html,"En 10 ans, Claude Guéant n'a retiré que ""800 euros"" de son compte"
https://www.youtube.com/watch?v=0LPZuj3gn7k,"""Je trolle le système!"": Marlène Schiappa justifie son intervention chez Cyril Hanouna"
https://www.20minutes.fr/politique/2245099-20180328-video-macron-chahute-ecoliers-4-ans-lors-visite-ecole-maternelle,VIDEO. Macron «chahuté» par des écoliers de 4 ans lors de sa visite dans une école maternelle
https://jack.mycanal.fr/articles/lire/alerte-david-hasselhoff-prepare-un-album-heavy-metal,Alerte : David Hasselhoff prépare un album heavy metal
